{
  "$schema": "https://json-schema.org/draft/2020-12/schema",
  "$id": "https://wayline.game/contracts/v1/second-wind-started.schema.json",
  "title": "Wayline Started Second Wind",
  "type": "object",
  "additionalProperties": false,
  "required": ["schemaVersion", "requestId", "secondWindId", "worldId", "battleId", "combatAttemptId", "quizBattleId", "batch"],
  "properties": {
    "schemaVersion": {"const": "wayline.v1"},
    "requestId": {"$ref": "progression-shared.schema.json#/$defs/identifier"},
    "secondWindId": {"$ref": "progression-shared.schema.json#/$defs/identifier"},
    "worldId": {"$ref": "progression-shared.schema.json#/$defs/identifier"},
    "battleId": {"$ref": "progression-shared.schema.json#/$defs/identifier"},
    "combatAttemptId": {"$ref": "progression-shared.schema.json#/$defs/identifier"},
    "quizBattleId": {"$ref": "progression-shared.schema.json#/$defs/identifier"},
    "batch": {"$ref": "public-quiz-batch.schema.json"}
  }
}
