{
  "schemaVersion": "wayline.v1",
  "requestId": "start-second-wind-001",
  "secondWindId": "second-wind-combat-attempt-001",
  "worldId": "valuehold",
  "battleId": "valuehold_route_1",
  "combatAttemptId": "combat-attempt-001",
  "quizBattleId": "valuehold_route_1_second_wind",
  "batch": {
    "schemaVersion": "wayline.v1",
    "batchId": "batch-001",
    "itemCount": 3,
    "items": [
      {
        "itemId":"item-001",
        "prompt":"What is 2.4 + 0.35?",
        "options":[
          {"optionId":"opt-001-a","displayText":"2.75"},
          {"optionId":"opt-001-b","displayText":"2.39"},
          {"optionId":"opt-001-c","displayText":"2.435"},
          {"optionId":"opt-001-d","displayText":"0.59"}
        ]
      },
      {
        "itemId":"item-002",
        "prompt":"What is 84 divided by 7?",
        "options":[
          {"optionId":"opt-002-a","displayText":"12"},
          {"optionId":"opt-002-b","displayText":"11"},
          {"optionId":"opt-002-c","displayText":"13"},
          {"optionId":"opt-002-d","displayText":"77"}
        ]
      },
      {
        "itemId":"item-003",
        "prompt":"Which number is 30 percent of 90?",
        "options":[
          {"optionId":"opt-003-a","displayText":"27"},
          {"optionId":"opt-003-b","displayText":"3"},
          {"optionId":"opt-003-c","displayText":"60"},
          {"optionId":"opt-003-d","displayText":"120"}
        ]
      }
    ]
  }
}
